{
  "authority": {
    "conflict_rule": "higher_precedence_registry_wins",
    "may_define_current_task": false,
    "may_override_object_registries": false,
    "scope": "container_identity_only"
  },
  "directories": [
    {
      "accepted_content": [
        {
          "label": "当前任务与运行的机器镜像",
          "object_id": "current_machine_state",
          "rule": "只有 Notion 现役账序回读后的当前状态进入这里。",
          "target_pattern": "governance/CURRENT_STATE.json"
        },
        {
          "label": "目录身份与落点规则",
          "object_id": "directory_identity",
          "rule": "只登记容器身份，不登记当前任务或业务结论。",
          "target_pattern": "governance/directory_registry.json"
        },
        {
          "label": "外置对象身份、位置与库存边界",
          "object_id": "artifact_storage_identity",
          "rule": "只登记对象身份、位置、消费者、生命周期、固定清单和已知冲突；不授权移动、删除或恢复。",
          "target_pattern": "governance/external_archive_registry.json"
        },
        {
          "label": "外置 payload 逐文件读取白名单",
          "object_id": "external_payload_validation_policy",
          "rule": "只列获准单件逐文件核验的外置对象和旧对象排除原因；不发现搬迁候选，不授权移动、删除或启用硬门。",
          "target_pattern": "governance/external_payload_validation_policy.json"
        },
        {
          "label": "实验仓外材料取件计划白名单",
          "object_id": "artifact_retrieval_policy",
          "rule": "只列允许解析的终态轻量卡和命名组合；只读固定 MANIFEST 并生成计划，不读取 payload 或执行复制。",
          "target_pattern": "governance/artifact_retrieval_policy.json"
        }
      ],
      "category": "governance",
      "consumers": [
        "Codex",
        "tools/governance_index.py",
        "tools/novel_pipeline.py",
        "tools/experiment_artifact_retrieval.py",
        "tools/external_payload_validator.py",
        "tools/repo_slim_inventory.py"
      ],
      "container_authority": "current",
      "directory_id": "DIR-GOVERNANCE",
      "evidence_refs": [
        "AGENTS.md",
        "governance/README.md",
        "governance/artifact_retrieval_policy.json",
        "governance/external_payload_validation_policy.json"
      ],
      "externalization": "prohibited",
      "git_policy": "tracked",
      "identity": "governance_control_plane",
      "inherit_to_children": false,
      "lifecycle": "mutable",
      "load_policy": "always_read",
      "new_content_rule": "只收治理真源、对象登记、合同和由生成器维护的索引；不得另写当前任务副本。",
      "open_decisions": [],
      "path": "governance",
      "path_kind": "directory"
    },
    {
      "accepted_content": [
        {
          "label": "API 地址与供应商访问规则",
          "object_id": "provider_config",
          "rule": "地址、授权边界和运输规则按供应商分开保存。",
          "target_pattern": "config/providers/<provider_id>"
        },
        {
          "label": "模型调用档案",
          "object_id": "model_call_profile",
          "rule": "每个调用档案有独立身份，可被测试工作区按白名单复制。",
          "target_pattern": "config/model_call_profiles/<profile_id>.json"
        },
        {
          "label": "API 请求响应 JSON 合同",
          "object_id": "api_payload_contract",
          "rule": "各 API 的 JSON 形状与档案同名归档，不混成通用猜测。",
          "target_pattern": "config/model_call_profiles/contracts/<profile_id>"
        },
        {
          "label": "正式提示词",
          "object_id": "formal_prompt",
          "rule": "提示词独立编号，调用时按清单复制，不从运行目录反向取真。",
          "target_pattern": "config/prompts/<prompt_id>"
        },
        {
          "label": "上下文组装配方",
          "object_id": "context_recipe",
          "rule": "只描述怎么拼装零件，不保存单次拼装出的完整上下文。",
          "target_pattern": "config/context_recipes/<recipe_id>"
        },
        {
          "label": "可复用任务 JSON 合同",
          "object_id": "task_contract",
          "rule": "跨试验复用的任务合同进入这里；单试验合同留在试验目录。",
          "target_pattern": "config/contracts/<contract_id>"
        },
        {
          "label": "历史回放轻量结论卡",
          "object_id": "historical_replay_result_card",
          "rule": "只留结论真源、仓外对象指针、命名取件组合和生成的人看页；完整回放现场继续留仓外。",
          "target_pattern": "config/test_replay/result_cards/<card_id>"
        }
      ],
      "category": "configuration",
      "consumers": [
        "tools",
        "tests",
        "experiment_materializer"
      ],
      "container_authority": "current",
      "directory_id": "DIR-CONFIG",
      "evidence_refs": [
        "AGENTS.md",
        "config/providers/provider_access_policy.json",
        "config/model_call_profiles/README.md"
      ],
      "externalization": "prohibited",
      "git_policy": "tracked",
      "identity": "configuration_contracts",
      "inherit_to_children": false,
      "lifecycle": "mutable",
      "load_policy": "task_scoped",
      "new_content_rule": "只收可复用配置、供应商规则、调用档案、提示词、上下文配方和已登记的轻量历史回放卡；不收完整单次运行现场。",
      "open_decisions": [],
      "path": "config",
      "path_kind": "directory"
    },
    {
      "accepted_content": [
        {
          "label": "产品数据 schema",
          "object_id": "product_schema",
          "rule": "需要跨模块长期复用时才进入这里。",
          "target_pattern": "schemas/<schema_id>.schema.json"
        }
      ],
      "category": "schema",
      "consumers": [
        "tools",
        "tests"
      ],
      "container_authority": "current",
      "directory_id": "DIR-SCHEMAS",
      "evidence_refs": [
        "schemas/z_candidate_v1.schema.json"
      ],
      "externalization": "prohibited",
      "git_policy": "tracked",
      "identity": "product_data_schemas",
      "inherit_to_children": false,
      "lifecycle": "mutable",
      "load_policy": "task_scoped",
      "new_content_rule": "只收产品数据或长期公共对象的 schema；治理合同留在 governance/contracts。",
      "open_decisions": [],
      "path": "schemas",
      "path_kind": "directory"
    },
    {
      "accepted_content": [
        {
          "label": "跨场景可复用程序",
          "object_id": "reusable_program",
          "rule": "必须有稳定输入、失败方式、定向测试和工具登记。",
          "target_pattern": "tools/<tool_id>.py"
        }
      ],
      "category": "code",
      "consumers": [
        "operators",
        "tests",
        "automation"
      ],
      "container_authority": "current",
      "directory_id": "DIR-TOOLS",
      "evidence_refs": [
        "governance/README.md",
        "governance/tool_registry.json"
      ],
      "externalization": "prohibited",
      "git_policy": "tracked",
      "identity": "reusable_programs",
      "inherit_to_children": false,
      "lifecycle": "mutable",
      "load_policy": "task_scoped",
      "new_content_rule": "只收已满足出生门槛的可复用程序；单批脚本留在试验或交件目录。",
      "open_decisions": [],
      "path": "tools",
      "path_kind": "directory"
    },
    {
      "accepted_content": [
        {
          "label": "机械测试",
          "object_id": "mechanical_test",
          "rule": "测试要说明保护的合同，夹具只保留最小可复现材料。",
          "target_pattern": "tests/test_<contract>.py"
        }
      ],
      "category": "code",
      "consumers": [
        "pytest",
        "Codex"
      ],
      "container_authority": "current",
      "directory_id": "DIR-TESTS",
      "evidence_refs": [
        "pytest.ini",
        "governance/test_policy.json"
      ],
      "externalization": "prohibited",
      "git_policy": "tracked",
      "identity": "mechanical_verification",
      "inherit_to_children": false,
      "lifecycle": "mutable",
      "load_policy": "task_scoped",
      "new_content_rule": "只收可复现的机械测试和最小夹具；真实正文与大型运行工件不得进入。",
      "open_decisions": [],
      "path": "tests",
      "path_kind": "directory"
    },
    {
      "accepted_content": [
        {
          "label": "未定型施工草稿",
          "object_id": "undecided_draft",
          "rule": "必须带归位条件，不能长期冒充正式落点。",
          "target_pattern": "work/<work_id>"
        },
        {
          "label": "新评测题集（落点待 CZ 拍板）",
          "object_id": "evaluation_item_set_pending_cz",
          "rule": "正式落点待 CZ 拍板。本条只占位，不发明新目录；拍板前未定型草稿可暂放 work/<eval_set_id>，不能冒充正式题集。",
          "target_pattern": "work/<eval_set_id>"
        }
      ],
      "category": "construction",
      "consumers": [
        "Codex",
        "human_review"
      ],
      "container_authority": "candidate",
      "directory_id": "DIR-WORK",
      "evidence_refs": [
        ".gitignore",
        "AGENTS.md"
      ],
      "externalization": "per_object_candidate",
      "git_policy": "mixed",
      "identity": "undecided_construction",
      "ignored_probe": "work/zbatch_decisions/__git_policy_probe__",
      "inherit_to_children": false,
      "lifecycle": "mutable",
      "load_policy": "task_scoped",
      "new_content_rule": "只收身份尚未定型的施工草稿；定型后回到 config、tools、schemas 或 experiments。",
      "open_decisions": [
        "新评测题集正式落点待 CZ 拍板；本条只占位，不发明新目录。"
      ],
      "path": "work",
      "path_kind": "directory"
    },
    {
      "accepted_content": [
        {
          "label": "单试验程序",
          "object_id": "experiment_program",
          "rule": "未证明跨场景复用前不得进入 tools 根层。",
          "target_pattern": "experiments/<experiment_id>/program"
        },
        {
          "label": "实验结论卡的人看页",
          "object_id": "experiment_result_card",
          "rule": "只由同目录机器卡确定性生成；大型运行现场按对象另行外置。",
          "target_pattern": "experiments/<experiment_id>/README.md"
        },
        {
          "label": "实验轻量结论真源",
          "object_id": "experiment_result_card_contract",
          "rule": "只留目的、组装规则、短结论、质量裁决、证据边界、消费者和指针引用。",
          "target_pattern": "experiments/<experiment_id>/result_card.json"
        },
        {
          "label": "实验仓外对象指针",
          "object_id": "experiment_external_pointer",
          "rule": "只钉外置对象编号和清单 SHA；真实位置只从外置对象登记册解析，不保存绝对路径。",
          "target_pattern": "experiments/<experiment_id>/external_pointer.json"
        },
        {
          "label": "实验命名取件组合",
          "object_id": "experiment_retrieval_profile",
          "rule": "只登记精确文件或整份固定清单的复制组合；不提供任意路径、glob 或直接复制能力。",
          "target_pattern": "experiments/<experiment_id>/retrieval_profile.json"
        }
      ],
      "category": "experiment",
      "consumers": [
        "experiment_runner",
        "reviewers",
        "tests"
      ],
      "container_authority": "candidate",
      "directory_id": "DIR-EXPERIMENTS",